<?xml version="1.0" encoding="UTF-8"?><xs:schema xmlns:xs="http://www.w3.org/2001/XMLSchema" elementFormDefault="qualified">	<xs:complexType name="dynamicParameterType">		<xs:simpleContent>			<xs:extension base="xs:string">				<xs:attribute name="id" type="xs:token" use="required"/>			</xs:extension>		</xs:simpleContent>	</xs:complexType>	<xs:element name="neat-run-output">		<xs:complexType>			<xs:sequence>				<xs:element name="neat-run-info">					<xs:complexType>						<xs:sequence>							<xs:element name="author" type="xs:string"/>							<xs:element name="description" type="xs:string"/>						</xs:sequence>					</xs:complexType>				</xs:element>				<xs:element name="search-parameters" minOccurs="0">					<xs:complexType>						<xs:sequence>							<xs:element name="population-size" type="xs:integer"/>							<xs:element name="neuron-mutation-probability" type="xs:decimal"/>							<xs:element name="connect-mutation-probability" type="xs:decimal"/>							<xs:element name="weight-mutation-probability" type="xs:decimal"/>							<xs:element name="compatibility-threshold" type="xs:decimal"/>							<xs:element name="disjoint-coefficient" type="xs:decimal"/>							<xs:element name="excess-coefficient" type="xs:decimal"/>							<xs:element name="weightdelta-coefficient" type="xs:decimal"/>							<xs:element name="survival-proportion" type="xs:decimal"/>							<xs:element name="dynamic-parameter" type="dynamicParameterType" maxOccurs="unbounded"/>						</xs:sequence>					</xs:complexType>				</xs:element>				<xs:element name="domain-config" minOccurs="0">					<xs:complexType>						<xs:sequence>							<xs:element name="domain-id">								<xs:complexType>									<xs:simpleContent>										<xs:extension base="xs:string">											<xs:attribute name="id" type="xs:string" use="required"/>											<xs:attribute name="version" type="xs:decimal" use="required"/>											<xs:attribute name="authoreddate" type="xs:string" use="required"/>											<xs:attribute name="description" type="xs:string" use="optional"/>										</xs:extension>									</xs:simpleContent>								</xs:complexType>							</xs:element>							<xs:element name="domain-parameters">								<xs:complexType>									<xs:sequence>										<xs:element name="input-node-count" type="xs:short"/>										<xs:element name="output-node-count" type="xs:short"/>										<xs:element name="dynamic-parameter" type="dynamicParameterType" maxOccurs="unbounded"/>									</xs:sequence>								</xs:complexType>							</xs:element>						</xs:sequence>					</xs:complexType>				</xs:element>				<xs:element name="run-state" minOccurs="0">					<xs:complexType>						<xs:sequence>							<xs:element name="max-innovation-id" type="xs:short"/>						</xs:sequence>					</xs:complexType>				</xs:element>				<xs:element name="generation">					<xs:complexType>						<xs:sequence>							<xs:element name="generation-info">								<xs:complexType>									<xs:sequence>										<xs:element name="save-time" type="xs:dateTime"/>										<xs:element name="max-fitness" type="xs:decimal"/>										<xs:element name="min-fitness" type="xs:decimal"/>										<xs:element name="avg-fitness" type="xs:decimal"/>										<xs:element name="species-count" type="xs:short"/>									</xs:sequence>								</xs:complexType>							</xs:element>							<xs:element name="specie">								<xs:complexType>									<xs:sequence>										<xs:element name="specie-info">											<xs:complexType>												<xs:sequence>													<xs:element name="age" type="xs:short"/>													<xs:element name="max-fitness" type="xs:decimal"/>													<xs:element name="min-fitness" type="xs:decimal"/>													<xs:element name="avg-fitness" type="xs:decimal"/>												</xs:sequence>											</xs:complexType>										</xs:element>										<xs:element name="genome" maxOccurs="unbounded">											<xs:complexType>												<xs:sequence>													<xs:element name="nodes">														<xs:complexType>															<xs:sequence>																<xs:element name="node" minOccurs="0" maxOccurs="unbounded">																	<xs:complexType>																		<xs:attribute name="id" type="xs:integer" use="required"/>																		<xs:attribute name="type" use="required">																			<xs:simpleType>																				<xs:restriction base="xs:token">																					<xs:enumeration value="bias"/>																					<xs:enumeration value="hid"/>																					<xs:enumeration value="in"/>																					<xs:enumeration value="out"/>																				</xs:restriction>																			</xs:simpleType>																		</xs:attribute>																	</xs:complexType>																</xs:element>															</xs:sequence>														</xs:complexType>													</xs:element>													<xs:element name="connections">														<xs:complexType>															<xs:sequence>																<xs:element name="connection" minOccurs="0" maxOccurs="unbounded">																	<xs:complexType>																		<xs:attribute name="innov-id" type="xs:integer" use="required"/>																		<xs:attribute name="src-id" type="xs:integer" use="required"/>																		<xs:attribute name="tgt-id" type="xs:integer" use="required"/>																		<xs:attribute name="enabled" type="xs:boolean" use="required"/>																		<xs:attribute name="weight" type="xs:decimal" use="required"/>																	</xs:complexType>																</xs:element>															</xs:sequence>														</xs:complexType>													</xs:element>												</xs:sequence>												<xs:attribute name="id" type="xs:integer" use="required"/>												<xs:attribute name="fitness" type="xs:decimal" use="required"/>												<xs:attribute name="primary-parent-id" type="xs:integer" use="required"/>												<xs:attribute name="secondary-parent-id" type="xs:integer" use="required"/>											</xs:complexType>										</xs:element>									</xs:sequence>									<xs:attribute name="id" type="xs:integer" use="required"/>									<xs:attribute name="size" type="xs:short" use="required"/>								</xs:complexType>							</xs:element>						</xs:sequence>						<xs:attribute name="id" type="xs:integer" use="required"/>					</xs:complexType>				</xs:element>			</xs:sequence>		</xs:complexType>	</xs:element></xs:schema>
<!-- neodl5.grp.bf1.yahoo.com Sat Oct 26 14:53:59 UTC 2019 -->
